{
  "schema_version": 1,
  "book_id": "01JZBOOK000000000000000001",
  "workspace_id": "01JZWORKSPACE0000000000001",
  "title": "Battle Through the Heavens",
  "author_name": "Tian Can Tu Dou",
  "source_type": "reference_novel",
  "import_status": "ready",
  "trace_id": "01JZTRC000000000000000001",
  "created_at": "2026-07-11T00:00:00Z",
  "updated_at": "2026-07-11T00:10:00Z"
}
